{"refuted":false,"reasoning":"The scoped absence holds. DESIGN.md:L2 states: \"Frontend discovery is advisory; transaction decisions must reread current chain state.\" Independent hidden/ignored inventories and transaction-caller/client-API searches found no frontend decision/submission implementation. requestDraw queries wrapper pricing during execution (target/packages/contracts/src/Raffle.sol:L240-L258,L436-L438), as does its inherited helper (target/packages/contracts/node_modules/@chainlink/contracts/src/v0.8/vrf/dev/VRFV2PlusWrapperConsumerBase.sol:L76-L89). These checks do not establish frontend refresh ordering. No stale-read path or external frontend behavior was established. Analysis, inspected paths, and search results were written to audit/S5/spec-compliance/requirements/04-REQ-44.md.","correction":null,"revisedVerdict":null}